类别,排序方式,图书名称,图书作者,作者简介,原价,折扣价,图书简介
通讯,最新,数字惠民 互联网应用适老化及无障碍实践优秀案例集 2023,中国信息通信研究院  中国互联网协会,中国信息通信研究院（以下简称“中国信通院”）始建于1957年。多年来，中国信通院始终秉持“国家高端专业智库 产业创新发展平台”的发展定位和“厚德实学 兴业致远”的核心文化价值理念，在行业发展的重大战略、规划、政策、标准和测试认证等方面发挥了有力支撑作用，为我国通信业跨越式发展和信息技术产业创新壮大起到了重要推动作用。 近年来，适应经济社会发展的新形势新要求，围绕国家“网络强国”和“制造强国”新战略，中国信通院着力加强研究创新，在强化电信业和互联网研究优势的同时，不断扩展研究领域、提升研究深度，在5G、工业互联网、智能制造、移动互联网、物联网、车联网、未来网络、云计算、大数据、人工智能、虚拟现实/增强现实（VR/AR）、智能硬件、网络与信息安 全等方面进行了深入研究与前瞻布局，在国家信息通信及信息化与工业化融合领域的战略和政策研究、技术创新、产业发展、安 全保障等方面发挥了重要作用，有力支撑了互联网+、制造强国、宽带中国等重大战略与政策出台和各领域重要任务的实施。,49.9,39.92,为深入贯彻《中华人民共和国无障碍环境建设法》有关规定，加快提升互联网网站、手机App适老化及无障碍水平，在工业和信息化 部信息通信管理局的指导下，中国信息通信研究院、中国互联网协会认真总结互联网应用适老化及无障碍改造实践经验做法，组织编制形成本书。    本书分为手机App篇和互联网网站篇，聚焦线上平台功能的升级改造与线下服务模式的创新优化，共收录38个互联网网站、手机App改造案例。案例主要围绕老年人/残疾人需求、功能创新、技术解决方案、用户实际体验等方面展开，展示了不同领域、不同类型的互联网网站、手机 App 在适老化及无障碍改造方面的探索经验及阶段性成果，为各相关单位、企业深入开展互联网应用适老化及无障碍改造工作提供有益参考。
通讯,最新,无线电简史,王枫 杨伟峰,王枫河北科技师范学院副教授，从事电子信息专业教学与科研工十七年。  杨伟峰从事无线电管理工作二十年，热爱并致力于无线电科普，参与策划多个无线电主题展览，制作的无线电科普视频在互联网广为传播。,89.8,71.84,无线电是对无线电波的使用的通称。无线电波是在空间传播的电磁波。赫兹在1887年前后用实验证实了电磁波的存在，他像盗火者普罗米修斯，把麦克斯韦预言的电磁波从书本中带到了人世间。人们开始研究如何利用电磁波进行通信，1895年前后，无线电技术诞生了。此后，无线电技术跨越百年时空，推动了现代科技的进步，抒写了人类文明演进的壮阔史诗。当前，无线电频谱作为一种特殊的自然资源和信息化无所不在的载体，正以澎湃的力量，支撑和保障车联网、5G/6G、卫星互联网等技术的快速发展，推动全行业的科技跃迁，赋予世界新的动能。本书通过讲述无线电发展史上的传奇故事，传播无线电科学和法规知识，加深读者对无线电的认识和了解，让我们共同感受无线电的惊天伟力。
通讯,最新,移动互联网匿名及应对技术,申屠浩、王良民、殷尚男、赵蕙,申屠浩，江苏大学讲师，主要研究领域为嵌入式系统开发、物联网系统设计、机器人设计和网络安全应用。主持和参与10多项嵌入式和物联网应用系统的开发和设计。王良民，东南大学特聘教授，教授(三级)、博士生导师，江苏省333工程第二层次(领军人才)，主要研究领域为密码学与安全协议。曾任江苏大学计算机科学与通信工程学院院长，近几年主持国家重点研发计划项目、国家自然科学基金重点项目等国家级科研课，牵头获得中国机械工业联合会二等奖、中国教育部科技成果二等奖和江苏省科技进步二等奖等。著有专著《无线传感网可生存理论与技术研究》、编著《虚拟网络新技术》，其中《虚拟网络新技术》入选“国之重器”出版工程，教材《物联网工程概论》、《应用密码学概论》入选“江苏省重点教材”，是高等教育出版社物联网工程系列教材编委、人民邮电出版社网络空间安全丛书编委、通信学报编委和网络与信息安全学报编委。殷尚男，韩国建国大学博士，江苏大学特聘副教授，主要研究领域为网络入侵检测和流量检测等方面，目前专注于流量检测技术在匿名网络追踪溯源领域的应用。在期刊和ACM系列会议发表论文7篇，对网络安全领域有多年相关研究经历。赵蕙，江苏大学实验师，主要研究领域为网络空间系统隐私保护等领域，目前主要专注于匿名通信协议的设计和评估。,129.8,103.84,匿名技术通过不可观察性和不可关联性来实现对通信双方的身份、位置或通信关系的隐藏。随着网络技术的发展，匿名技术与应对技术产生了革新式的变化，本书从技术发展脉络的角度厘清这一趋势。首先，介绍了传统的基于洋葱路由的匿名网络工具，重点关注匿名技术从覆盖层匿名通信系统到网络层匿名通信协议的变化；然后，阐述了匿名技术与应对技术的相关原理、分析工作，并给出详细的实践操作方法，使读者更好地了解匿名网络的结构与意义，帮助初学者从零开始搭建匿名网络平台。本书内容新颖，注重理论联系实际，可作为电子信息工程、计算机科学与技术、网络安全等相关专业的研究生、高年级本科生以及相关科研人员、工程技术人员的参考书籍。
通讯,最新,物联网协议体系与智能服务,任保全 祝幸辉 郭永安,任保全军事科学院系统工程研究院研究员，主要从事信息通信网络架构设计与技术应用、物联网协议与路由方法、网络智能化技术等研究。祝幸辉西安电子科学大学准聘副教授，主要从事物联网技术、网络安 全、安 全计算等研究。郭永安南京邮电大学教授，主要从事智能通信网络路由与协议设计、多模态智能信息处理方法、物联网智能信息系统架构设计与技术应用等研究。,129.8,103.84,本书面向新一代物联网关键技术的创新发展与智能服务应用，将前沿理论与实践案例紧密结合，并介绍了团队在物联网领域研究的新成果。　　全书共9章，介绍了物联网的基本知识、协议体系和发展现状；讨论了当前的主流物联网平台、接入方法以及终端协议创新发展情况；介绍了物联网代表性应用场景和面临的安 全问题以及解决方法；从数据特征、服务模型、体系结构等角度对物联网的智能服务进行了阐述；讨论了面向智能服务的物联网协议设计方法；讨论了物联网发展存在的问题和未来的发展方向。　　本书可作为高校研究生、政府工作人员、企业技术人员理解和学习物联网技术及其应用的重要参考书。
通讯,最新,网络空间安全实践能力分级培养(II),陈凯 肖凌 汤学明 王美珍,陈凯 副教授，硕士生导师。担任华中科技大学网络空间安全学院副院长，担任湖北网络空间安全学会理事、本科教学工作组主任。 致力人才培养，独立承担多门门本科课程和硕士研究生课程教学，发表多篇有一定影响力的教改论文，出版教材一部，主持多项校级和省级教改项目。 潜心做科研，从事计算机网络应用及安全、物联网安全、工业互联网安全研究，发表多篇高水平文章，主持和参与多项科研项目，申请专利和软著多项。,149.8,119.84,本书基于网络空间安全实践能力分级培养教学体系中的第二级教学计划编制，旨在为教学过程提供素材。本书通过丰富的案例讲解，意在培养读者的动手能力，激发读者的学习兴趣，增强社会对网络空间安全的态势感知及攻防对抗能力。本书分为网络安全技术篇、Web应用安全篇和密码技术篇，包括网络安全工具介绍，计算机网络数据嗅探和欺骗技术，典型的协议安全问题及攻击技术，Web应用中的典型安全问题及攻防方法，古典密码、序列密码、公钥密码和分组密码的分析技术等。本书适合高等院校网络空间安全、信息安全、计算机等专业的师生及其他对网络空间安全感兴趣的读者参考阅读。
通讯,最新,HCIA-Transmission学习指南,华为技术有限公司,华为技术有限公司 华为技术有限公司，成立于1987年，总部位于广东省深圳市龙岗区。华为是全球信息与通信技术（ICT）解决方案供应商，专注于ICT领域，坚持稳健经营、持续创新、开放合作，在电信运营商、企业、终端和云计算等领域构筑了端到端的解决方案优势，为运营商客户、企业客户和消费者提供有竞争力的ICT解决方案、产品和服务，并致力于实现未来信息社会、构建更美好的全联接世界。,109.8,87.84,本书是华为HCIA-Transmission认证考试的官方指导用书，阐述了传送网所涉及的基本知识，其中包括传送网的概念，SDH帧结构、复用、开销，波分复用，TDM，OTN，NMS以及下一代传送网技术等，对传送网中使用的华为设备、工具仪表进行了说明，并列举了华为的应用方案。    本书适合正在准备考取华为HCIA-Transmission认证的人员、从事传送网相关工作的人员阅读，也可作为高等院校相关专业的师生的参考教材。
通讯,最新,光传输技术与应用,张勇 唐鹏 梁舒 高峰,张勇，北京华晟经世信息技术股份有限公司董事长、联合创始人。联合教育部学校规划建设发展中心、教育部中外人文交流中心共同设计实施教育部-ICT行业创新基地、教育部-ICT产教融合创新基地、“互联网+中国制造2025”产教融合促进计划、新一代信息技术“智慧学习工场（2020）”、人文交流经世项目等产教融合引领项目，负责项目部的顶层设计、实施推进等。参与起草制定《5G移动网络运维职业技能等级标准》《光宽带网络建设职业技能等级证书》《工业机器人系统运维员国家职业技能标准》等1+X等级证书标准。 唐鹏，辽宁开放大学（辽宁装备制造职业技术学院）通信教研室主任，从事高职教育和开放教育课程管理工作事，主讲课程：计算机辅助制图、微机组装与维护、计算机应用（vb）、数据结构、网络操作系统、计算机基础实训、嵌入式操作系统（Linux）、通信工程制图等课程，通信网络与综合布线。 梁舒，北京华晟经世信息技术股份有限公司执行副总裁，先后在高校、企业，从事专业教学、项目管理及公司运营管理等工作。高校工作期间，主要从事数字信号处理及无线通信技术方面的教学及学术研究工作；企业工作期间，熟悉国内知名通信公司的产品特点，有着丰富的营销、项目运作和管理经验。 高峰，电气与电子工程系副主任，“双师型”教师，曾担任湖北省职业技能鉴定指导中心评审专家。长期从事物联网方向的教科研工作。现为物联网工程专业负责人，湖北省高校优秀基层教学组织“电子信息ICT校企融合教学团队”主要成员，基于校企联合的物联网科研创新团队负责人，中兴通信学院“双创团队”负责人；拥有湖北省职业技能实训指导教师证书、高级人工智能研发工程师、4G移动通信工程师等多个证书。,59.8,47.84,本书介绍了光传输技术的基本原理和应用，以及在网络建设和维护过程中的实例。全书分为4个模块：光传输技术简介模块主要介绍了光纤通信的起源、光纤通信的线缆、光纤通信中所涉及的指标及相关技术的发展；SDH网络建设模块包括SDH基本原理、SDH设备硬件选型、SDH网络平台的组建、SDH业务配置，以及传输网保护的配置；PTN网络建设模块包括PTN网络规划、PTN组网配置、PTN业务配置和PTN保护配置；传输网维护模块主要介绍了传输网的日常维护和故障处理。
通讯,最新,5G网络流量DPI技术与应用,唐宏 曹维华 高敏 刘浩 李文云 朱华虹 扶奉超 等,唐宏中国电信股份有限公司广州研究院数据通信研究所所长，从事IP承载网、下一代互联网、网络新技术方面的研发与管理工作。,109.8,87.84,5G是数字经济时代的战略性基础设施，是新一轮科技革命和产业变革的重要驱动力量。5G的eMBB、mMTC、URLLC三大主要应用场景，将进一步促进人与人、人与物、物与物的深度互联，赋能千行百业。5G网络流量深度包检测（DPI）在5G产业生态中具有重要的作用，没有5G网络流量DPI技术手段做相应支撑，难以满足5G面向千行百业的智慧化运营需求，也没有5G产业的快速稳定发展。5G核心网云化部署、控制面与转发面分离、SBI、MEC及用户面下沉、端到端切片等诸多架构变革及CT与IT的融合对5G网络流量的检测、识别与分析提出了新的挑战。    本书共6章，分别为网络流量检测技术概述、5G网络流量接入、汇聚分流技术、5G网络流量分析技术、5G网络流量DPI系统部署及总结，从基本原理、关键技术、系统实现、应用等方面对5G网络流量DPI技术进行深入浅出的介绍，以提高产学研界对5G网络流量DPI技术的认知、理解和运用水平，助力提升5G智慧化运营能力、支撑千行百业的蓬勃发展。
通讯,最新,5G-TSN协同架构与关键技术,王健全 孙雷 马彰超 丰雷 黄蓉,王健全工学博士，北京科技大学教授、博士生导师、国家“万人计划”科技创新领军人才、国家重点研发计划项目科学 家、工业互联网战略咨询专 家委员会委员，主要研究方向为“感知—通信—控制”一体化融合网络关键技术、工业互联网、工业网络协同，主持或参与多项重大专项项目，发表论文100余篇，获得授权发明专利100余项，编写图书9部。孙雷工学博士，北京科技大学副教授，主要研究方向为5G与工业网络协同、时间敏感网络关键机制、5G与时间敏感网络协同传输关键技术、“通信—计算—控制”一体化融合关键技术，发表论文40余篇，获得授权发明专利50余项，牵头制定ITU-T国际标准4项，参与编写《时间敏感网络技术及发展趋势》《无线网络架构与演进趋势》等多部图书。马彰超工学博士，北京科技大学副教授、国际电信联盟标准化部门量子信息网络焦点组量子保密通信工作组（ITU-T FG-QIT4N WG2）主席，中国通信标准化协会ST7量子信息处理工作组副组长，主要研究方向为新一代工业控制系统与5G、量子安 全融合应用，发表论文20余篇，授权发明专利30余项，主导编制标准20余项，编写图书多部。丰雷工学博士，北京邮电大学副教授、博士生导师，主要研究方向为无线网络智能管理与优化、蜂窝物联网资源分配、移动通信技术垂直行业应用等，主持并参与多项国家 级科研项目，发表论文110余篇，授权发明专利30余项，参与编写《6G需求与愿景》《漫话6G》等多部图书。黄蓉工学博士、正高 级工程师，中国联通集团级技术专 家、中国联通研究院研究员，IMT-2030（6G）推进组需求工作组副组长，主要研究方向为移动通信网络架构及关键技术、确定性网络等，主持或参与国家和集团级项目20余项，授权发明专利40项，负责行业标准20项，编写图书2部。,129.8,103.84,确定性网络是当前研究的热点，具有低时延、高可靠保障的确定性网络机制是 ICT 赋能垂直行业应用的关键，也是工业互联网的重要网络保障机制。本书从工业互联网、移动通信网络和时间敏感网络的基础概念出发，重点对5G-TSN 协同架构、适配 TSN 的5G 网络技术增强、5G-TSN 协同调度关键技术进行介绍，并对基于5G-TSN 的云化控制系统和5G-TSN 应用场景进行了展望。
通讯,最新,通信系统实战笔记 无处不在的信号处理,梁敏,梁敏本科和硕士毕业于北京邮电大学电信工程学院，本科是电信工程专业，硕士是通信与信息系统专业，连续4年获一等奖学金，是优 秀毕业生。 2000年到2007年，在北京信威通信技术有限公司做研发，终端事业部的技术负责人，参与了SCDMA系统的标准制定，产品从无到商用化的整个开发过程，获得国家技术进步一等奖的第十一人。 2007年到2017年，在创业芯片设计公司，作为CTO，参与GSM和LTE芯片的架构，系统软件算法和协议栈的从无到有的全开发过程。 2017年至今，在创业科技公司，作为CTO，参与自定义物联网协议的标准设计和全系统开发的整个过程。 个人在通信系统，芯片设计方面的发明专利40多项，第 一发明人的20余项。,69.8,55.84,通信系统理论内容与实际的工程开发既相互联系，又有区别。本书基于作者20多年的通信系统开发经验，重新审视通信系统理论与工程开发的重点、难点知识，期望引发读者思考，帮助读者构建个人知识体系、提升工程实践能力。本书重点阐述了在全球移动通信系统（GSM）、长期演进技术（LTE）、全球定位系统（GPS）等通信系统技术、产品开发中遇到的问题与思考、通信工程中常用的算法和其内在的物理含义，以及通信系统架构设计的逻辑等。此外，本书还介绍了通信芯片采用的电路及其原理、通信芯片与软件无线电系统之间的关系、底层逻辑等内容，并结合5G系统的物理层关键参数和过程定义对5G系统进行分析，对其工程开发进行解读，构建5G芯片架构。本书通俗易懂，案例丰富，实践性强，适合通信专业的大学生及从事通信系统开发的工程师阅读，也适合希望跨专业了解通信系统的工程师阅读。
通讯,最新,光联万物 千兆光网行业应用案例汇编,中国信息通信研究院,中国信息通信研究院始建于1957年，多年来中国信息通信研究院始终秉持“国家高端专业智库 产业创新发展平台”的发展定位和“厚德实学 兴业致远”的核心文化价值理念，在行业发展的重大战略、规划、政策、标准和测试认证等方面发挥了有力支撑作用，为我国通信业跨越式发展和信息技术产业创新壮大起到了重要推动作用。　　近年来，中国信息通信研究院着力加强研究创新，在强化电信业和互联网研究优势的同时，不断扩展研究领域、提升研究深度，在4G/5G、工业互联网、智能制造、移动互联网、物联网、车联网、未来网络、云计算、大数据、人工智能、虚拟现实/增强现实（VR/AR）、智能硬件、网络与信息安 全等方面进行了深入研究与前瞻布局，在国家信息通信及信息化与工业化融合领域的战略和政策研究、技术创新、产业发展、安 全保障等方面发挥了重要作用，有力支撑了互联网+、制造强国、宽带中国等重大战略与政策出台和各领域重要任务的实施。,99.8,79.84,本书从千兆光网的发展演进、技术内涵等维度阐述千兆光网的整体价值内涵，同时对千兆光网在数字政府、数字经济、数字社会维度的支撑价值进行了概括性阐述。本书围绕社会经济与民生相关领域，聚焦业内代表性强、模式可复制的千兆光网融合应用，收录了智能制造、智慧医疗、智慧教育、数字政府、智能建造、数字金融、智慧城市、信息消费、交通运输、文旅体育、数字乡村领域的案例，展示了当前千兆光网融合应用在各垂直行业中的落地效果，为传统产业的数字化转型提供经验借鉴和支撑。
通讯,最新,基于无线协同中继信道的物理层安全技术,巩向武 任保全 李洪钧 钟旭东 林金,巩向武军事科学院系统工程研究院助理研究员，主要从事通信与信息系统方面的研究工作，主持、参加多项国 家级重点项目、省部级重点项目，发表学术论文十余篇，申请/授权发明专利十余项，获2020年度中国通信学会科学技术奖二等奖一项。任保全军事科学院系统工程研究院高 级工程师，主要从事通信网络技术研究工作，主持、参加多项国家级重点项目、省部级重点项目等二十余项，授权发明专利五项，发表学术论文五十余篇，获省部级科学技术进步奖二、三等奖多项。李洪钧，军事科学院系统工程研究院高 级工程师，主要从事智能网络、卫星通信、物联网等方面研究工作，主持、参加多项国 家级重点项目、省部级重点项目等十余项，授权发明专利十项，发表学术论文二十余篇，获2020年度中国通信学会科学技术奖二等奖一项。钟旭东军事科学院系统工程研究院高 级工程师，主要从事空间信息网络、认知卫星通信网络等方面研究工作，主持、参加多项国 家级重点项目、省部级重点项目等十余项，授权发明专利四项，发表学术论文三十余篇，获2020年度中国通信学会科学技术奖二等奖一项。,79.9,63.92,无线物理层安 全旨在利用无线信道特性来设计有效的安 全通信策略，它从信息论安 全的角度增强现有无线通信系统的安 全性，为解决无线通信安 全问题提供了一种新的思路，具有重要的研究价值和广阔的应用前景。本书概述了无线物理层安 全的发展历程、关键技术和研究现状，阐述了基于无线协同中继信道的物理层安 全技术的理论基础和研究意义，研究了不同拓扑结构、不同信道状态信息条件下，基于分布式波束成形、人工噪声和协同干扰等技术的安 全传输技术，完善了无线协同中继系统物理层安 全技术的理论分析方法，定量地刻画了系统参数与性能度量指标之间的关系，提出了不同场景下的安 全传输方案，从而为实现无线协同中继系统中信息的安 全可靠传输提供了理论和技术支撑。    本书可供无线通信与传输技术、卫星通信、物联网等领域的科研人员参考阅读，也适合信息与通信工程相关专业的本科生和研究生阅读。
通讯,最新,业余卫星通信,张宁,张宁男，1979年10月出生，2004年毕业于重庆大学。现为国家无线电监测中心乌鲁木齐监测站总工程师、中国通信协会公共安 全通信专业委员会委员、南京航空航天大学硕士研究生行业导师。从事无线电管理与技术、无线电监测等研究。李英华女，1981年9月出生于湖北，2005年毕业于清华大学。现为国家无线电监测中心副处长、高 级工程师，从事无线电系统间电磁兼容性分析、无线电管理政策等研究。刘明星男，1984年11月，2009年毕业于华侨大学。现为国家无线电监测中心乌鲁木齐监测站卫星室副主任、高 级工程师，从事无线电频谱资源管理和监测工作，主要研究方向是卫星互联网的频率使用和监测方法。,89.8,71.84,业余卫星通信是利用人造地球卫星开展的业余无线电通信活动，是一种可以使无线电信号实现超视距传播的现代化通信方式，也是简便的体验卫星通信全过程的有效手段之一。作为业余无线电的重要组成部分，卫星通联是业余无线电通信发展史上重要的里程碑。大量业余卫星的发射，引发了业余无线电爱好者研究和探索卫星通信的极大兴趣，推动了业余无线电技术的快速发展。    本书用深入浅出的语言讲述了业余卫星通信发展的历史，讲解了卫星通信的基本原理、主要特点和卫星的系统组成，介绍了当前在轨的业余卫星和业余卫星通信的操作方法，分享了组建地球站开展业余卫星通联的经验，力求帮助业余无线电爱好者选择合适的通联卫星和地球站设备，能够亲身体验业余卫星通联的乐趣。    本书作为科普读物，主要面向青少年科技爱好者和业余无线电爱好者，普及业余卫星通信的相关知识，也可作为学校开展业余无线电兴趣活动、研学实践等的参考书。
